{
  "$schema": "http://json-schema.org/draft-07/schema#",
  "title": "AccessReview",
  "type": "object",
  "properties": {
    "id": { "type": "string" },
    "clientId": { "type": "string" },
    "name": { "type": "string" },
    "description": { "type": "string" },
    "scopeType": { "type": "string", "enum": ["global", "household", "entity", "portfolio", "role", "module"] },
    "scopeId": { "type": "string" },
    "periodStart": { "type": "string", "format": "date" },
    "periodEnd": { "type": "string", "format": "date" },
    "dueAt": { "type": "string", "format": "date" },
    "status": { "type": "string", "enum": ["draft", "active", "closed"] },
    "completionPct": { "type": "number" },
    "reviewerIds": { "type": "array", "items": { "type": "string" } },
    "createdAt": { "type": "string", "format": "date-time" },
    "closedAt": { "type": "string", "format": "date-time" }
  },
  "required": ["id", "name", "status"]
}
