[
  {"id": "rev-001", "clientId": "global", "name": "Q4 2024 Admin Access Review", "description": "Quarterly review of administrative and privileged access", "scopeType": "role", "scopeId": "role-001", "periodStart": "2024-10-01", "periodEnd": "2024-12-31", "dueAt": "2025-01-15", "status": "closed", "completionPct": 100, "reviewerIds": ["usr-001", "usr-005"], "createdAt": "2024-12-15T10:00:00Z", "closedAt": "2025-01-14T16:00:00Z"},
  {"id": "rev-002", "clientId": "global", "name": "Q1 2025 Client Access Review", "description": "Review of all client portal users", "scopeType": "role", "scopeId": "role-008", "periodStart": "2025-01-01", "periodEnd": "2025-03-31", "dueAt": "2025-02-28", "status": "active", "completionPct": 35, "reviewerIds": ["usr-006", "usr-005"], "createdAt": "2025-01-05T10:00:00Z"},
  {"id": "rev-003", "clientId": "global", "name": "Investment Module Access Review", "description": "Review access to investment and portfolio modules", "scopeType": "module", "scopeId": "portfolio", "periodStart": "2025-01-01", "periodEnd": "2025-01-31", "dueAt": "2025-02-15", "status": "active", "completionPct": 60, "reviewerIds": ["usr-002", "usr-005"], "createdAt": "2025-01-10T10:00:00Z"},
  {"id": "rev-004", "clientId": "global", "name": "Operations Team Review", "description": "Annual review of operations team access", "scopeType": "role", "scopeId": "role-004", "periodStart": "2024-01-01", "periodEnd": "2024-12-31", "dueAt": "2025-01-31", "status": "draft", "completionPct": 0, "reviewerIds": ["usr-004", "usr-005"], "createdAt": "2025-01-20T10:00:00Z"},
  {"id": "rev-005", "clientId": "global", "name": "Security Module Access Review", "description": "Review of security and admin access", "scopeType": "module", "scopeId": "security", "periodStart": "2025-01-01", "periodEnd": "2025-03-31", "dueAt": "2025-03-15", "status": "draft", "completionPct": 0, "reviewerIds": ["usr-001", "usr-016"], "createdAt": "2025-01-25T10:00:00Z"},
  {"id": "rev-006", "clientId": "global", "name": "Financial Access Review", "description": "Review CFO and finance team access", "scopeType": "role", "scopeId": "role-003", "periodStart": "2024-07-01", "periodEnd": "2024-12-31", "dueAt": "2025-01-10", "status": "closed", "completionPct": 100, "reviewerIds": ["usr-001", "usr-005"], "createdAt": "2024-12-20T10:00:00Z", "closedAt": "2025-01-09T14:00:00Z"}
]
